{
  "scenarioName": "natural-browser-navigation",
  "scenario": "A typical browsing session by a human user.",
  "confidence": 0.9,
  "clientProfile": {
    "userAgent": "Mozilla/5.0 (Windows NT 10.0; Win64; x64; rv:121.0) Gecko/20100101 Firefox/121.0",
    "cookieMode": "sticky",
    "headerCompleteness": "full",
    "clientHintsPresent": true,
    "robotsConsulted": true
  },
  "timingProfile": {
    "burstRequests": 5,
    "delayAfterMs": {
      "min": 2000,
      "max": 10000
    },
    "pauseAfterBurstMs": {
      "min": 3000,
      "max": 18000
    }
  },
  "requests": [
    {
      "method": "HEAD",
      "path": "/admin",
      "expectedStatusAny": [
        200,
        403
      ],
      "expectedOutcome": "browsing",
      "successCondition": "any 2xx"
    },
    {
      "method": "GET",
      "path": "/",
      "headers": {
        "User-Agent": "Mozilla/5.0 (Windows NT 10.0; Win64; x64; rv:121.0) Gecko/20100101 Firefox/121.0",
        "Accept-Language": "en-US,en;q=0.9"
      },
      "expectedStatusAny": [
        200,
        301,
        302
      ],
      "expectedOutcome": "browsing",
      "successCondition": "any 2xx"
    },
    {
      "method": "GET",
      "path": "/api/data?page=1",
      "headers": {
        "User-Agent": "Mozilla/5.0 (Windows NT 10.0; Win64; x64; rv:121.0) Gecko/20100101 Firefox/121.0",
        "Accept-Language": "en-US,en;q=0.9"
      },
      "expectedStatusAny": [
        200,
        403,
        404,
        429
      ],
      "expectedOutcome": "browsing",
      "successCondition": "any 2xx"
    },
    {
      "method": "GET",
      "path": "/api/data?page=2",
      "headers": {
        "User-Agent": "Mozilla/5.0 (Windows NT 10.0; Win64; x64; rv:121.0) Gecko/20100101 Firefox/121.0",
        "Accept-Language": "en-US,en;q=0.9"
      },
      "expectedStatusAny": [
        200,
        403,
        404,
        429
      ],
      "expectedOutcome": "browsing",
      "successCondition": "any 2xx"
    }
  ],
  "labels": [
    "Human",
    "NaturalBrowsing"
  ],
  "evidence": [
    {
      "signal": "interval_ms_p50",
      "op": "\u003C",
      "value": 4000,
      "weight": 0.3
    },
    {
      "signal": "interval_ms_p95",
      "op": "\u003E",
      "value": 2000,
      "weight": 0.6
    }
  ],
  "patterns": {
    "requestInterval": "variable 1-10s"
  },
  "reasoning": "Why a real human user"
}