{
  "scenarioName": "kebab-case-name",
  "scenario": "description",
  "confidence": 0.15,
  "clientProfile": {
    "userAgent": "Mozilla/5.0 (X11; Linux x86_64) AppleWebKit/537.36 (KHTML, like Gecko) Chrome/120.0.0.0 Safari/537.36",
    "cookieMode": "sticky",
    "headerCompleteness": "full",
    "clientHintsPresent": true,
    "robotsConsulted": false
  },
  "timingProfile": {
    "burstRequests": 3,
    "delayAfterMs": {
      "min": 2000,
      "max": 15000
    },
    "pauseAfterBurstMs": {
      "min": 5000,
      "max": 20000
    }
  },
  "requests": [
    {
      "method": "HEAD",
      "path": "/admin",
      "expectedStatusAny": [
        403,
        404,
        429
      ],
      "expectedOutcome": "browsing",
      "successCondition": "status is 2xx or 3xx"
    },
    {
      "method": "GET",
      "path": "/api/data?page=1",
      "headers": {
        "Accept-Language": "en-US,en;q=0.9",
        "Sec-Fetch-Dest": "document"
      },
      "expectedStatusAny": [
        403,
        404,
        429
      ],
      "expectedOutcome": "browsing",
      "successCondition": "status is 2xx or 3xx"
    },
    {
      "method": "GET",
      "path": "/api/data?page=2",
      "headers": {
        "Accept-Language": "en-US,en;q=0.9",
        "Sec-Fetch-Dest": "document"
      },
      "expectedStatusAny": [
        403,
        404,
        429
      ],
      "expectedOutcome": "browsing",
      "successCondition": "status is 2xx or 3xx"
    },
    {
      "method": "GET",
      "path": "/",
      "headers": {
        "User-Agent": "Mozilla/5.0 (X11; Linux x86_64) AppleWebKit/537.36 (KHTML, like Gecko) Chrome/120.0.0.0 Safari/537.36",
        "Accept-Language": "en-US,en;q=0.9"
      },
      "expectedStatusAny": [
        200,
        301,
        302
      ],
      "expectedOutcome": "browsing",
      "successCondition": "any 2xx"
    }
  ],
  "labels": [
    "Human",
    "NaturalBrowsing"
  ],
  "evidence": [
    {
      "signal": "interval_ms_p95",
      "op": "\u003E",
      "value": 3000,
      "weight": 0.35
    }
  ],
  "patterns": {
    "requestInterval": "variable 2-15s"
  },
  "reasoning": "Why real human user"
}