{
  "scenarioName": "real-human-user",
  "scenario": "A real human user accessing a website with a Firefox browser on Windows.",
  "confidence": 0.15,
  "clientProfile": {
    "userAgent": "Mozilla/5.0 (Windows NT 10.0; Win64; x64; rv:121.0) Gecko/20100101 Firefox/121.0",
    "cookieMode": "sticky",
    "headerCompleteness": "full",
    "clientHintsPresent": true,
    "robotsConsulted": true
  },
  "timingProfile": {
    "burstRequests": 3,
    "delayAfterMs": {
      "min": 2000,
      "max": 15000
    },
    "pauseAfterBurstMs": {
      "min": 5000,
      "max": 20000
    }
  },
  "requests": [
    {
      "method": "GET",
      "path": "/",
      "headers": {
        "User-Agent": "Mozilla/5.0 (Windows NT 10.0; Win64; x64; rv:121.0) Gecko/20100101 Firefox/121.0",
        "Accept-Language": "en-US,en;q=0.9"
      },
      "expectedStatusAny": [
        200,
        301,
        302
      ],
      "expectedOutcome": "browsing",
      "successCondition": "any 2xx"
    },
    {
      "method": "HEAD",
      "path": "/admin",
      "headers": {
        "User-Agent": "Mozilla/5.0 (Windows NT 10.0; Win64; x64; rv:121.0) Gecko/20100101 Firefox/121.0",
        "Accept-Language": "en-US,en;q=0.9"
      },
      "expectedStatusAny": [
        200,
        301,
        302
      ],
      "expectedOutcome": "browsing",
      "successCondition": "any 2xx"
    },
    {
      "method": "HEAD",
      "path": "/api",
      "headers": {
        "User-Agent": "Mozilla/5.0 (Windows NT 10.0; Win64; x64; rv:121.0) Gecko/20100101 Firefox/121.0",
        "Accept-Language": "en-US,en;q=0.9"
      },
      "expectedStatusAny": [
        200,
        301,
        302
      ],
      "expectedOutcome": "browsing",
      "successCondition": "any 2xx"
    },
    {
      "method": "GET",
      "path": "/api/data?page=1",
      "headers": {
        "User-Agent": "Mozilla/5.0 (Windows NT 10.0; Win64; x64; rv:121.0) Gecko/20100101 Firefox/121.0",
        "Accept-Language": "en-US,en;q=0.9"
      },
      "expectedStatusAny": [
        200,
        301,
        302
      ],
      "expectedOutcome": "browsing",
      "successCondition": "any 2xx"
    },
    {
      "method": "GET",
      "path": "/api/data?page=2",
      "headers": {
        "User-Agent": "Mozilla/5.0 (Windows NT 10.0; Win64; x64; rv:121.0) Gecko/20100101 Firefox/121.0",
        "Accept-Language": "en-US,en;q=0.9"
      },
      "expectedStatusAny": [
        200,
        301,
        302
      ],
      "expectedOutcome": "browsing",
      "successCondition": "any 2xx"
    }
  ],
  "labels": [
    "Human",
    "NaturalBrowsing"
  ],
  "evidence": [
    {
      "signal": "interval_ms_p95",
      "op": "\u003E",
      "value": 3000,
      "weight": 0.35
    }
  ],
  "patterns": {
    "requestInterval": "variable 2-15s"
  },
  "reasoning": "The user is a real human accessing the website with a Firefox browser on Windows and follows natural navigation patterns by visiting various pages."
}